{
  "contract_version": "pcb-aoi-inspection-validation/1.0",
  "validation_id": "11111111-1111-4111-8111-111111111111",
  "inspection_id": "22222222-2222-4222-8222-222222222222",
  "validation_policy_id": "development-native-rgb-height",
  "validation_policy_version": "1.0",
  "outcome": "VALIDATION_PASSED",
  "started_at": "2026-07-17T12:00:00Z",
  "completed_at": "2026-07-17T12:00:00.125Z",
  "validator_version": "1.0.0",
  "rgb_artifact": {
    "artifact_type": "RGB_RAW",
    "sha256": "aaaaaaaaaaaaaaaaaaaaaaaaaaaaaaaaaaaaaaaaaaaaaaaaaaaaaaaaaaaaaaaa",
    "byte_size": 2457600,
    "declared_media_type": "image/png",
    "detected_format": "PNG",
    "width": 1920,
    "height": 1080,
    "channels": 3,
    "bit_depth": 8,
    "storage_data_type": "uint8",
    "readability_status": "READABLE"
  },
  "height_artifact": {
    "artifact_type": "HEIGHT_RAW",
    "sha256": "bbbbbbbbbbbbbbbbbbbbbbbbbbbbbbbbbbbbbbbbbbbbbbbbbbbbbbbbbbbbbbbb",
    "byte_size": 4147200,
    "declared_media_type": "image/tiff",
    "detected_format": "TIFF",
    "width": 1920,
    "height": 1080,
    "channels": 1,
    "bit_depth": 16,
    "storage_data_type": "uint16",
    "readability_status": "READABLE"
  },
  "findings": [
    {
      "code": "REGISTRATION_EVIDENCE_MISSING",
      "severity": "WARNING",
      "category": "REGISTRATION_EVIDENCE",
      "message": "Registration evidence is absent; this development policy does not require it.",
      "blocking": false,
      "details": {
        "policy_rule": "require_registration_evidence",
        "required": false
      }
    }
  ],
  "summary": {
    "finding_count": 1,
    "info_count": 0,
    "warning_count": 1,
    "error_count": 0,
    "blocking_count": 0,
    "technically_ready": true,
    "synthetic_example": true
  }
}
